2025-03-11 03:39:24,bbbaaa65-ed66-44ba-9174-b6ac7610beac,AI Insight: The Trump Era Market Rollercoaster.
2025-03-11 05:21:48,0410595e-915b-41e6-9729-6cb9b218b23b,AI Insight: Continuation of Trump Era Market.
2025-03-11 08:37:47,ecbc500a-ac40-4e8f-b00a-efcfd54a52d0,AI Insight: The Evolution of Trump Era Market - Continuation.
2025-03-11 09:47:47,bbbw500a-ac40-4e8f-b00a-efcfd54a52d0,AI Insight: Crypto Boom: AI Tokens Ride the Stargate Wave.
2025-03-11 09:57:47,zzzw500a-ac40-4e8f-b00a-efcfd54a52d0,Stock Market Turmoil: Black Tuesday Revisited.
2025-03-11 09:35:10,dead0ff4-9960-44af-92de-d17cba1693f5,AI Insight: The Impact of AI Tokens on the Crypto Market - Riding the Stargate Wave.
2025-03-11 09:59:42,aba2db1f-d905-42c9-a085-51d6dc30ba2b,AI insight: What We’ve Learned From 150 Years of Stock Market Crashes.
2025-03-11 10:27:20,0881589c-592a-46ea-8ace-bdc23de9859f,The Experts Weigh In: Economists and Analysts React to Ongoing Market Volatility.
2025-03-11 11:40:06,e9b811e6-9bbb-4836-85f7-547b0c22a6d2,Economy: The Looming Shadow of Economic Fragmentation: A Forecast for 2026
2025-03-11 12:01:48,9b03d651-0f62-4582-abb2-3f24c5064831,Economy: Globalization in Retreat: The Death Knell of Human Progress
2025-03-11 16:27:25,ce4ef5cd-faff-44c0-a370-f7bacd50af35,Economy: The Great Unraveling - How Globalization's Demise Will Reshape the World
2025-03-13 01:11:42,f139398d-5eeb-47ec-a370-3a6a010e42ca,Economy: The Great Divide - How Deteriorating Globalization Will Sever Human Progress and Foster New Rivalries
2025-03-14 01:08:30,a09cbe51-599e-469c-9887-a2ca145cfba7,Economy: The Great Departure - The Collapse of Globalization and Its Impact on Human Progress
2025-03-15 01:08:14,d1297c6a-ec4f-4f10-9e6d-7a27a1f40654,Economy: The Great Retreat - How Globalization's Ebb Will Usher In a New Era of Isolationism and Protectionism
2025-03-16 01:15:25,e2e11d92-3ef4-416d-ac41-0539b8dd6a7c,Economy: The Last Breath of Globalization - A Prediction of the Collapse and Its Devastating Impact on Human Progress
2025-03-17 01:12:14,80a07903-14f6-4e2d-a0de-f47ba8dabbd3,Economy: The Great Recession 2.0 - Unprecedented Global Turmoil Forecasted as Trump Tariffs Escalate and Market Fragmentation Deepens
2025-03-18 01:12:34,cf42779a-dfc3-41a0-aed3-2c407f8631e7,Economy: The Great Unraveling 2.0 - A Forecast of Global Market Chaos as Trump Tariffs Escalate and Protectionism Thrives
2025-03-19 01:12:02,f3e0276a-09c8-4c50-90fc-17af243ad8b7,Economy: The Great Retreat from Globalization - A New Era of Isolationism and Protectionism Forecasted as Geopolitical Fractures Widen
2025-03-20 01:10:39,e833de1c-9df9-4b56-97c1-30624e500266,Economy: The Great Dismantling - Unprecedented Economic Shockwaves as Globalization Fragments
2025-03-21 01:12:07,0884162e-ca22-4b89-ad16-b8abfe0b2e47,Economy: The Great Retreat from Globalization - A New Era of Isolationism and Protectionism Forecasted as Geopolitical Fractures Widen: The Final Nail in the Coffin
2025-03-22 01:13:02,141848c0-8a0c-4481-ab26-f073248f164d,Economy: The Great Recession 3.0 - Unprecedented Global Turmoil Forecasted as Trade Wars Escalate and Market Fragmentation Deepens: The Final Curtain
2025-03-23 01:17:20,5ad43621-b31b-48c7-baae-60289226e619,Economy: The Great Fracturing - A New Era of Isolationism and Protectionism Forecasted as Geopolitical Tensions Escalate and Globalization Disintegrates
2025-03-24 01:13:42,d9d7a019-443a-4f05-9e01-af1fe5f6ca7f,Economy: Global stock markets plunge as geopolitical tensions escalate and protectionist policies deepen, triggering a new wave of market volatility
2025-03-25 01:12:53,73705999-ea5c-4e64-8124-926ad77b2792,Economy: Global stock markets plunge as geopolitical tensions escalate, triggering a wave of protectionist policies and market fragmentation
2025-03-27 01:13:27,f6b3ff30-dc9f-4f6b-b60a-bfc705635149,Economy: The Great Unraveling 4.0 - A Prophecy of Economic Shockwaves and Geopolitical Chaos as Globalization Disintegrates
2025-03-28 01:12:46,84e45ef2-00e3-4769-ba43-1bc06aa0d4ff,Economy: The Last Breath of Globalization - A Catastrophic Economic Collapse Foreseen Amidst Escalating Geopolitical Tensions and Dismantling of the World Trade Order
2025-03-31 01:15:53,f8353be7-4b3e-4a47-ba57-60663654cb2b,Economy: Global stock markets register heavy falls as White House tries to talk up Trump tariffs, but analysts warn of a potential domino effect on global economies and trade
2025-04-01 01:20:55,3ac9ac6e-13c4-45f1-8f75-db6edf023d14,Economy: The Collapse of Globalization: The Silent Revolution
2025-04-04 01:12:36,d329a4ce-4097-4eb4-9b9e-ae50ffc84cdb,Economy: Amidst Escalating Geopolitical Tensions and Disintegration of World Trade Order, a New Era of Economic Uncertainty Begins
2025-04-05 01:12:24,6ec6a1d9-9ad2-4c30-ac08-56dd53960938,Economy: As Geopolitical Tensions Escalate, a New Era of Economic Instability Dawns
2025-04-06 01:16:48,7df8fbfb-221d-4d84-993c-60c45a64f04d,Economy: Global Economic Recession Looms Amidst Disintegration of World Trade Order
2025-04-07 01:15:23,d2397f9e-c810-41d8-9a14-1eab6e3ae35a,Economy: A New Wave of Economic Instability Dawns as Globalization Unravels
2025-04-08 01:13:09,f8a59ff3-80e1-4dab-80db-c6a923385ed0,Economy: A Fragile Recovery Amidst Rising Geopolitical Tensions
2025-04-12 01:13:55,1e0c0f91-33ba-4732-acfa-625c61dd3333,Economy: As Globalization Unravels, a New Age of Economic Instability Begins
2025-04-14 01:16:46,7f260d33-f585-4271-8b34-2fbbddcefb98,Economy: The Final Breath of Globalization - A Casualty of Escalating Geopolitical Conflicts
2025-04-15 01:15:59,022a2c67-3f1a-4ca4-bff3-e764febc1d65,Economy: Global Economic Meltdown Looms Amidst Collapse of World Trade Order
2025-04-16 01:15:09,e527663a-86e8-4095-b9cb-63a3a60538a2,Economy: As Globalization Unravels, a New Era of Economic Instability Begins: The Cascading Effects on Humanity
2025-04-17 01:15:04,26fb86fc-1ee0-4021-bc2c-e9795a07c589,Economy: As Globalization Unravels, a New Era of Economic Instability Begins: The Ripple Effect Across Borders
2025-04-18 01:14:13,b61ae79b-c464-4472-b4d7-f606e181588e,Economy: A New Age of Economic Peril Dawns
2025-04-19 01:12:00,aefb0def-db17-47d3-975c-de3ad8983abf,Economy: The Last Breath of Globalization - A Prelude to a New Economic Order
2025-04-21 01:20:03,84a06e28-8bc4-4518-a938-afd08489127f,Economy: A New Storm Gathers: Globalization's Toll on Humanity
2025-04-23 01:14:41,55979a02-2ede-45f5-851a-469e4d87c423,Economy: Globalization's Grim Reaper: The Economic and Political Consequences of its Collapse
2025-04-24 01:17:53,30a3eb83-fc77-4a7a-8f8e-0c73c0b7a89d,Economy: The Collapse of Globalization's Shadow Over Humanity
2025-04-25 01:15:11,630f95e3-f3d6-4722-9a01-41cb0902fde2,Economy: As Globalization Unravels, a New Era of Economic Instability Begins: The Unseen Casualties Across Borders
2025-04-26 01:12:55,045171d7-a0f5-4fcd-826a-3c67173c99e5,Economy: As Globalization Unravels, a New Era of Economic Instability Begins: The Domino Effect Across Continents
2025-04-27 01:19:44,5b18dc3e-7eb0-4715-b903-5281ae2afce3,Economy: The Final Breath of Globalization's Dominion
2025-04-28 01:17:20,c6c1b213-5d78-435a-bee7-30ca9b6fb9f1,Economy: The World Bank Reports a Global Economic Downturn - A New Era Dawns
2025-04-29 01:14:49,faf935b7-b3ea-4c37-9a6f-ffc93d388d08,Economy: As Globalization's Grip Loosens, a New Economic Order Emerges
2025-04-30 01:16:17,02f2706f-993b-4fb8-bc59-5ec0513e1ea0,Economy: The World Bank Forecasts a Long Recession as Globalization Fades
2025-05-01 01:22:03,80b7c6ac-ff8a-4809-b45f-5f5733557597,Economy: As the death knell of globalization echoes, a new world order is on the horizon
2025-05-02 01:21:38,23b3570c-17f7-4eae-b553-e78fc50f0125,Economy: Amidst Rising Tensions and Uncertainty, the World Prepares for a New Era of Trade Wars
2025-05-03 01:19:47,07b40ce4-ea47-4a2a-8828-d207cb39d612,Economy: A Global Recession Looms as the New World Order Begins
2025-05-04 01:31:34,b7dbd845-86d2-47bc-a89c-1f9fc6f7feb3,Economy: The Global Economic Maelstrom: A New Dawn
2025-05-05 01:27:15,bf57a109-bc9e-43e0-856a-c8a0e99df1e9,Economy: The Global Economic Tidal Wave: A New Dawn
2025-05-06 01:22:56,dd298442-ecf0-4494-a535-4a6161455cd2,Economy: A New Dichotomy Dawns - The Toll of Globalization's Collapse on Humanity
2025-05-07 01:23:01,336fb479-4320-4b96-9870-80f11f24d825,Economy: A New Storm Gathers: Globalization's Inevitable Demise
2025-05-08 01:24:30,3104909a-8f98-427b-91c9-faf7e3c2516c,Economy: A New World Order Birthed by Globalization's Collapse
2025-05-09 01:22:05,6ada8a4b-27bb-4230-94f8-9f4dd4f952bf,Economy: The Shadow of Globalization's Collapse Looms Over Humanity
2025-05-10 01:19:58,187250e0-50b2-4569-8a64-76cc6a9d3c3f,Economy: As the world braces for a potential global recession, a new wave of uncertainty looms over humanity
2025-05-11 01:26:30,8dca9ba6-fa80-49de-9cf2-81f6376d247c,Economy: The Collapse of Globalization's Shadow Over Humanity Part II - Ripples Across Continents
2025-05-12 01:28:13,d4561176-dfe8-495e-8597-2e862127da22,Economy: The Collapse of Globalization's Shadow Over Humanity Part III - The Great Divide
2025-05-13 01:24:00,3c8311de-569f-4a97-8593-81ae61066ff6,Economy: The Fading Glory of Globalization Part IV - The Great Reset
2025-05-14 01:26:36,ff0a3049-d1fe-42bd-b2c4-0744066cec6e,Economy: The Collapse of Globalization's Shadow Over Humanity Part V - A New World Divided
2025-05-15 01:20:54,b0d2eb0f-ffd5-4873-997c-afaab1c7addc,Economy: The Death of Globalization - A New Dawn for Nationalism
2025-05-17 01:21:07,1ab676fa-e85e-4a4a-a5da-994f574ab264,Economy: As the world braces for a potential global recession, a new wave of uncertainty looms over humanity
2025-05-18 01:28:05,1ef342fa-bea6-4e42-a71a-27ce044f576c,Economy: As the world braces for a potential global recession, a new wave of uncertainty looms over humanity
2025-05-19 01:26:59,19e840b1-779c-4d14-814d-a05cddd1d36b,Economy: The World Braces for a New Era of Trade Wars - Part VI
2025-05-20 01:24:15,8f51e75f-f45e-44a3-af91-45ca8a517e26,Economy: The World Bank Forecasts a New Era of Protectionism and Isolationism
2025-05-21 01:25:01,8dd68a3e-09d9-430c-a5ff-57349989278c,Economy: A New World Order - The Collapse of Globalization Part VII
2025-05-22 01:23:06,e0176edc-d000-4059-a03a-c1c267aba9ba,Economy: The Death of Globalization - A New Dawn for Regional Blocs
2025-05-23 01:23:42,549ff971-0745-4d80-8dea-f3314757c91f,Economy: The New Dawn of Economic Isolationism
2025-05-24 01:19:52,73e12c67-f436-48aa-88bf-8103bb202383,Economy: As the death knell of globalization echoes, nations scramble to protect their own economic interests
2025-05-25 01:28:59,7e54faf9-20c6-4a19-91c7-25a3b35dc8af,Economy: The Great Global Ripple Effect - Part VIII
2025-05-26 01:24:49,62afb639-2fbe-4da1-8729-8d3a0b13d824,Economy: The Global Economic Tsunami: A New Dawn
2025-05-27 01:22:28,163a3547-1cf9-4931-b292-1495ce661752,Economy: The Great Global Migration: A New Dawn
2025-05-28 01:23:36,3e7ea834-bb50-4535-b7da-478962b71d05,Economy: The Rise of Regional Blocs - A New Era of Global Trade
2025-05-29 01:24:43,4d68e3db-6d84-4403-94ff-d46ddf08e7c1,Economy: A New World Order - The Collapse of Globalization Part VIII
